{
  "schema_version": "0.1.0",
  "run": {
    "id": "m11-recovery-drill-20261001T220142-92d2",
    "suite": "m11-recovery-drill",
    "started_at": "2026-10-01T22:01:42.749Z",
    "finished_at": "2026-10-01T22:02:24.264Z",
    "commit": {
      "sha": "6d5d7cd563153a5fbbe53ca6910c70d5ffead882",
      "dirty": true
    },
    "environment": {
      "node": "v22.23.1",
      "platform": "win32",
      "arch": "x64",
      "ci": false
    },
    "target": {
      "id": "prod-like-local",
      "mode": "real",
      "description": "compose.prod.yaml (redis, restart, rollback, restore) on one workstation; IMAGE_TAG=local"
    }
  },
  "results": [
    {
      "metric": "m11_recovery_drill_checks_passed",
      "dimension": "deployment",
      "unit": "ratio",
      "source": "infra/scripts/recovery-drill.mjs",
      "value": 1,
      "numerator": 21,
      "denominator": 21,
      "threshold": {
        "operator": "==",
        "value": 1
      },
      "status": "MEASURED",
      "passed": true
    },
    {
      "metric": "drill_redis_down_run_accept_ms",
      "dimension": "latency",
      "unit": "ms",
      "source": "infra/scripts/recovery-drill.mjs",
      "value": 1519,
      "denominator": 1,
      "notes": "One observation on one workstation (Docker Desktop); illustrative, not an SLA.",
      "status": "MEASURED"
    },
    {
      "metric": "drill_redis_outage_ms",
      "dimension": "latency",
      "unit": "ms",
      "source": "infra/scripts/recovery-drill.mjs",
      "value": 6865,
      "denominator": 1,
      "notes": "One observation on one workstation (Docker Desktop); illustrative, not an SLA.",
      "status": "MEASURED"
    },
    {
      "metric": "drill_redis_recovery_ms",
      "dimension": "latency",
      "unit": "ms",
      "source": "infra/scripts/recovery-drill.mjs",
      "value": 1287,
      "denominator": 1,
      "notes": "One observation on one workstation (Docker Desktop); illustrative, not an SLA.",
      "status": "MEASURED"
    },
    {
      "metric": "drill_restart_to_ready_ms",
      "dimension": "latency",
      "unit": "ms",
      "source": "infra/scripts/recovery-drill.mjs",
      "value": 4554,
      "denominator": 1,
      "notes": "One observation on one workstation (Docker Desktop); illustrative, not an SLA.",
      "status": "MEASURED"
    },
    {
      "metric": "drill_rollback_detect_ms",
      "dimension": "latency",
      "unit": "ms",
      "source": "infra/scripts/recovery-drill.mjs",
      "value": 2669,
      "denominator": 1,
      "notes": "One observation on one workstation (Docker Desktop); illustrative, not an SLA.",
      "status": "MEASURED"
    },
    {
      "metric": "drill_rollback_restore_ms",
      "dimension": "latency",
      "unit": "ms",
      "source": "infra/scripts/recovery-drill.mjs",
      "value": 4670,
      "denominator": 1,
      "notes": "One observation on one workstation (Docker Desktop); illustrative, not an SLA.",
      "status": "MEASURED"
    },
    {
      "metric": "drill_backup_dump_ms",
      "dimension": "latency",
      "unit": "ms",
      "source": "infra/scripts/recovery-drill.mjs",
      "value": 464,
      "denominator": 1,
      "notes": "One observation on one workstation (Docker Desktop); illustrative, not an SLA.",
      "status": "MEASURED"
    },
    {
      "metric": "drill_restore_instance_ready_ms",
      "dimension": "latency",
      "unit": "ms",
      "source": "infra/scripts/recovery-drill.mjs",
      "value": 3099,
      "denominator": 1,
      "notes": "One observation on one workstation (Docker Desktop); illustrative, not an SLA.",
      "status": "MEASURED"
    },
    {
      "metric": "drill_restore_pg_restore_ms",
      "dimension": "latency",
      "unit": "ms",
      "source": "infra/scripts/recovery-drill.mjs",
      "value": 701,
      "denominator": 1,
      "notes": "One observation on one workstation (Docker Desktop); illustrative, not an SLA.",
      "status": "MEASURED"
    },
    {
      "metric": "drill_restore_total_ms",
      "dimension": "latency",
      "unit": "ms",
      "source": "infra/scripts/recovery-drill.mjs",
      "value": 4922,
      "denominator": 1,
      "notes": "One observation on one workstation (Docker Desktop); illustrative, not an SLA.",
      "status": "MEASURED"
    }
  ],
  "summary": {
    "expected": 0,
    "simulated": 0,
    "measured": 11,
    "failed": 0
  }
}
