{
  "schema_version": "0.1.0",
  "run": {
    "id": "m11-k8s-local-20261001T233643-ecf5",
    "suite": "m11-k8s-local",
    "started_at": "2026-10-01T23:36:43.780Z",
    "finished_at": "2026-10-01T23:43:07.510Z",
    "commit": {
      "sha": "17a10867cc03eceddab4c9d64e880f65af19a906",
      "dirty": true
    },
    "environment": {
      "node": "v22.23.1",
      "platform": "win32",
      "arch": "x64",
      "ci": false
    },
    "target": {
      "id": "prod-like-local",
      "mode": "real",
      "description": "infra/k8s/overlays/local on rancher/k3s:v1.33.1-k3s1 in Docker; images IMAGE_TAG=local"
    }
  },
  "results": [
    {
      "metric": "m11_k8s_local_checks_passed",
      "dimension": "deployment",
      "unit": "ratio",
      "source": "infra/scripts/k8s-local.mjs",
      "value": 1,
      "numerator": 11,
      "denominator": 11,
      "threshold": {
        "operator": "==",
        "value": 1
      },
      "status": "MEASURED",
      "passed": true
    },
    {
      "metric": "k8s_cluster_ready_ms",
      "dimension": "latency",
      "unit": "ms",
      "source": "infra/scripts/k8s-local.mjs",
      "value": 10670,
      "denominator": 1,
      "notes": "One observation on one workstation (Docker Desktop); illustrative, not an SLA.",
      "status": "MEASURED"
    },
    {
      "metric": "k8s_image_import_ms",
      "dimension": "latency",
      "unit": "ms",
      "source": "infra/scripts/k8s-local.mjs",
      "value": 153588,
      "denominator": 1,
      "notes": "One observation on one workstation (Docker Desktop); illustrative, not an SLA.",
      "status": "MEASURED"
    },
    {
      "metric": "k8s_deploy_to_ready_ms",
      "dimension": "latency",
      "unit": "ms",
      "source": "infra/scripts/k8s-local.mjs",
      "value": 54302,
      "denominator": 1,
      "notes": "One observation on one workstation (Docker Desktop); illustrative, not an SLA.",
      "status": "MEASURED"
    },
    {
      "metric": "k8s_rollout_undo_ms",
      "dimension": "latency",
      "unit": "ms",
      "source": "infra/scripts/k8s-local.mjs",
      "value": 471,
      "denominator": 1,
      "notes": "One observation on one workstation (Docker Desktop); illustrative, not an SLA.",
      "status": "MEASURED"
    }
  ],
  "summary": {
    "expected": 0,
    "simulated": 0,
    "measured": 5,
    "failed": 0
  }
}
