{
  "schema_version": "0.1.0",
  "run": {
    "id": "m11-demo-k8s-20261001T234026-aaaa",
    "suite": "m11-demo-k8s",
    "started_at": "2026-10-01T23:40:26.343Z",
    "finished_at": "2026-10-01T23:40:31.615Z",
    "commit": {
      "sha": "17a10867cc03eceddab4c9d64e880f65af19a906",
      "dirty": true
    },
    "environment": {
      "node": "v22.23.1",
      "platform": "win32",
      "arch": "x64",
      "ci": false
    },
    "target": {
      "id": "prod-like-local",
      "mode": "real",
      "description": "k8s overlays/local (k3s) behind Traefik ingress TLS at https://localhost:9443; deterministic template provider (no LLM)"
    }
  },
  "results": [
    {
      "metric": "m11_demo_k8s_checks_passed",
      "dimension": "deployment",
      "unit": "ratio",
      "source": "infra/scripts/demo.mjs",
      "value": 1,
      "numerator": 18,
      "denominator": 18,
      "threshold": {
        "operator": "==",
        "value": 1
      },
      "status": "MEASURED",
      "passed": true
    },
    {
      "metric": "demo_case1_order_status_ms",
      "dimension": "latency",
      "unit": "ms",
      "source": "infra/scripts/demo.mjs",
      "value": 491,
      "denominator": 1,
      "notes": "One observation on one workstation (Docker Desktop); illustrative, not an SLA.",
      "status": "MEASURED"
    },
    {
      "metric": "demo_case2_recommendation_ms",
      "dimension": "latency",
      "unit": "ms",
      "source": "infra/scripts/demo.mjs",
      "value": 449,
      "denominator": 1,
      "notes": "One observation on one workstation (Docker Desktop); illustrative, not an SLA.",
      "status": "MEASURED"
    },
    {
      "metric": "demo_case3_inventory_ms",
      "dimension": "latency",
      "unit": "ms",
      "source": "infra/scripts/demo.mjs",
      "value": 446,
      "denominator": 1,
      "notes": "One observation on one workstation (Docker Desktop); illustrative, not an SLA.",
      "status": "MEASURED"
    },
    {
      "metric": "demo_approval_end_to_end_ms",
      "dimension": "latency",
      "unit": "ms",
      "source": "infra/scripts/demo.mjs",
      "value": 1270,
      "denominator": 1,
      "notes": "One observation on one workstation (Docker Desktop); illustrative, not an SLA.",
      "status": "MEASURED"
    }
  ],
  "summary": {
    "expected": 0,
    "simulated": 0,
    "measured": 5,
    "failed": 0
  }
}
